sex,bdate,city,groups_activities
м,,Комаричи,"Фотография; Фотография; Городское сообщество; Литература; Строительство, ремонт; Культура; Эротика; Дизайн интерьера; Одежда, обувь; Творчество; Литература; Поэт; Фото- и видеосъёмка; Профессиональные услуги; Литература; Юмор; Стиль, одежда, обувь; Юмор"
м,2.12.1986,Саратов,
м,,Анапа,"Дизайн и графика; Видеоигры; Творчество; Юмор; Шоу, передача; Настольные игры; Видеоигры; Блогер; Творчество; Юмор; Наука; Видеоигры; Обучающие курсы; Юмор; Видеоигры; Видеоигры; Инди; Игры; Юмор; Шоу, передача"
м,14.1.1989,Самара,"Городское сообщество; Видеоигры; Юмор; Комик; Интернет-СМИ; Недвижимость; Активный отдых; Творчество; Городское сообщество; Фотография; Интернет-СМИ; Продукты питания, напитки; Образование; Кино; Туризм, путешествия; Соседи; Видеоигра; Видеоигры; Мебель; Государственная организация"
ж,,Пермь,"Обучающие курсы; Отдых на природе; Творчество; Творчество; Здоровый образ жизни; Городское сообщество; Творчество; Веб-студия; Другие товары; Юмор; Музыкальная группа; Творчество; Продукты питания, напитки; Творчество; Товары для творчества; Творчество; Творчество; Творчество; Школа; Кулинария"
м,10.10.1986,Саратов,
м,,,"Автовладельцы; Автовладельцы; Юмор; Автовладельцы; Бизнес; Часы; Видеоигры; Фотография; Бизнес; Блогер; Городское сообщество; Кино; Другие услуги; Кино; Другая музыка; Производство, промышленность; Объявления; Юмор; Юмор; Блогер"
м,,Астрахань,Интернет-СМИ; Образование; Юмор; Творчество; Творчество; Наука; Творчество; Зоопарк; Интернет-СМИ; Здоровый образ жизни; Наука; Творчество; Городское сообщество; Юмор; Юмор; Юмор; Дискуссионный клуб; Образование; Музыкальные инструменты; Велосипеды
ж,,,
м,1.2.1986,Москва,"ВКонтакте; Комик; Дом культуры; Литература; Шоу, передача; История; Шоу, передача; Интернет-СМИ; Юмор; Комик; Учёный, преподаватель; Блогер; Образование; Образование; Другие товары; Общество; История; Кино; ВКонтакте; Шоу, передача"
м,,Москва,"Шоу, передача; Юмор; Образование; Дизайн и графика; Программирование; Программирование; Программирование; Дизайн и графика; Юмор; Наука; Юмор; Программирование; Городское сообщество; Образование; Юмор; Творчество; Интернет-СМИ; Общественная организация; Программирование; Юмор"
м,,Москва,"Юмор; Юмор; Юмор; Юмор; Блогер; Юмор; Юмор; Кино; Юмор; Наука; Юмор; Кулинария, рецепты; Юмор; Закрытое сообщество; Игры; Шоу, передача; Кулинария; Онлайн-игра; Юмор; Наука"
ж,28.7.1993,,"Фан-сообщество; Видеоигры; Юмор; Приложение; Юмор; Анимация; Домашние и дикие животные; Анимация; Юмор; Анимация; Музыкант; Образование; Фан-сообщество; Дискуссионный клуб; Фан-сообщество; Музей, галерея, выставка; Шоу, передача; Юмор; Юмор; Художник или художница"
ж,3.6.1989,,"Туризм, путешествия; Городское сообщество; Кафе, ресторан; Дизайн и графика; Блогер; Юмор; Здоровый образ жизни; Спа-салон; Творчество; Сайты; Государственная организация; Культурный центр; Страна; Туризм, путешествия; Кафе, ресторан; Спа-салон; Галерея; Стиль, одежда, обувь; Обмен музыкой; Искусство и развлечения"
м,,Москва,"Интернет-СМИ; Блогер; Интернет-СМИ; Блогер; Информационный портал; Интернет-СМИ; Блогер; Городское сообщество; Творчество; Интернет-СМИ; Техника, электроника; Техника, электроника; Автомобили; Кино; Юмор; Программирование; Юмор; Интернет-СМИ; Наука; Государственная организация"
м,,,
м,11.5.1989,,"Туризм, путешествия; История; Культура; Творчество; Видеоигры; Творчество; Творчество; Культура; Игры; Образование; Городское сообщество; Дизайн и графика; Образование; Обмен музыкой; Творчество; Фотография; Творчество; Дизайн и графика; Творчество; Творчество"
м,11.5.1983,Смоленск,Информационный портал; Художница; Юмор; Юмор; Здоровый образ жизни; История; История; Анимация; История; Домашние и дикие животные; Творчество; Культура; Видеоигра; Видеоигры; История; Художница; История; Образование; История; История
м,,Нижний Новгород,"Фотография; Интернет-СМИ; Фотография; Фотография; Фотография; Анимация; Фотография; Фотография; Фотограф; Дизайн интерьера; Одежда, обувь; Одежда, обувь; Стиль, одежда, обувь; Творчество; Фотография; Фотография; Дизайн и графика; Стиль, одежда, обувь; Туризм, путешествия; Фотография"
ж,,Волгоград,"Музыкант; Другая музыка; Интернет-СМИ; Музыкант; Музыкальные инструменты; Знакомства; Туризм, путешествия; Футбольная команда; Лотерея, розыгрыш; Блогер; Рок; Тексты, аккорды; Электронная музыка; Рыбалка; Другие товары; Городское сообщество; Музыкант; Тексты, аккорды; Классическая музыка; Дискуссионный клуб"
м,18.2.1980,,"Телеканал; Телеканал; Образование; Фотография; Дизайн и графика; Творчество; Творчество; Фан-сообщество; Туризм, путешествия; Дизайн и графика; Художник; Фитнес; Интернет-СМИ; Дизайн и графика; Фотография; Городское сообщество; История; Дизайн и графика; Обучающие курсы; Дизайн и графика"
ж,,Великий Новгород,"Лицей; Государственная организация; Отдых на природе; Фото- и видеосъёмка; Садоводство; Общественная организация; Государственная организация; Городское сообщество; Государственная организация; Культурный центр; Товары для дачи, огорода; Дизайн и графика; Кино; Общество; Юмор; Предприниматель; Строительство, ремонт; Интернет-СМИ; ВКонтакте; Уход за собой"
м,,Москва,"Юмор; Видеоигры; Видеоигры; Фан-сообщество; Соседи; Кино; Танцы; Видеоигры; Спортивная организация; Наука; Юмор; Программное обеспечение; Туризм, путешествия; Юмор; Игры; Танцы; Видеоигры; Видеоигры; Игры; Сериал"
м,,Мурманск,"Услуги для автовладельцев; Интернет-СМИ; Городское сообщество; Городское сообщество; Городское сообщество; Домашние и дикие животные; Дом культуры; Интернет-СМИ; Общество; Городское сообщество; Шоу, передача; Наука; Услуги для автовладельцев; Туры, экскурсии; Видеоигра; Туризм, путешествия; Интернет-СМИ; Образование; Банк, финансовое учреждение; Культура"
м,1.8.1992,Санкт-Петербург,"Юмор; История; Шоу, передача; Знакомства; Юмор; Электроника; Юмор; Юмор; Творчество; Фотография; Фотография; Общество; Юмор; Творчество; Интернет-СМИ; Интернет-СМИ; Городское сообщество; Юмор; Творчество; Туризм, путешествия"
м,,Тюмень,"Техника, электроника; Фотография; Фотография; Фото- и видеосъёмка; Интернет-СМИ; Музыкальная группа; Производство, промышленность; Туризм, путешествия; Блогер; Интернет-СМИ; Дискуссионный клуб; Туры, экскурсии; Каток; Туризм, путешествия; Другие хобби; Настольные игры; Обучающие курсы; Концертный зал; Туризм, путешествия; Программное обеспечение"
м,2.9.1982,Псков,"Видеоигры; Литература; Видеоигра; Музыкант; Туризм, путешествия; Видеоигры; Творчество; Творчество; Блог; Музыка; Творчество; Обмен музыкой; Творчество; Фото- и видеосъёмка; Музыкант; Видеоигры; Музыкальная группа; Культура; Интернет-СМИ; Художник"
м,28.10.1988,Краснодар,Видеоигры; Юмор; Философия; Автомобили; Интернет-СМИ; Страна; Фотограф; Юмор; Юмор; Рыбалка; Фотография; Юмор; Юмор; Городское сообщество; Видеоигры; Игры; Юмор; Критик; Сайты; Юмор
м,26.4.1990,Москва,"Дизайн и графика; Творчество; Кино; Туризм, путешествия; Туризм, путешествия; Туризм, путешествия; Творчество; Дизайн и графика; Творчество; Туризм, путешествия; Туризм, путешествия; Фотография; Культура; Туризм, путешествия; Страна; Творчество; Культура; Религия; История; Фотография"
м,,Praha,
ж,,Москва,
ж,17.8.1987,Тула,"Городское сообщество; Студия звукозаписи; Кафе, ресторан; Дизайн и графика; Художник; Организация праздников; Фото- и видеосъёмка; Образование; Фото- и видеосъёмка; Кино; Кино; Туризм, путешествия; Художник; Музей, галерея, выставка; Бар, паб; Знакомства; Образование; Другие товары; Культурный центр; Творчество"
ж,,Алматы,"Дизайн и графика; Товары для творчества; Творчество; Шоу, передача; Футбол; Rap, Hip-Hop; Литература; Образование; Творчество; Кино; Блогер; Юмор; Художник или художница; Художница; Вымышленный персонаж; Образование; Футбол; Наука; Музыкант"
ж,,Москва,Домашние и дикие животные; Товары для животных; Домашние и дикие животные; Дизайн интерьера; Домашние и дикие животные; Культура; Домашние и дикие животные; Юмор; Дизайн и графика; Домашние и дикие животные; Товары для животных; Дизайн и графика; Дизайн и графика; Домашние и дикие животные; Зоомагазин; Религия; Домашние и дикие животные; Домашние и дикие животные; Вымышленный персонаж; Бизнес
ж,,Санкт-Петербург,"Обучающие курсы; Творчество; Образование; Баня, сауна; Музей, галерея, выставка; Дизайнер; Дизайнер; Дизайн и графика; Производство контента; Литература; Бизнес; Религиозное учреждение; Объявления; Одежда, обувь; Знакомства; Бизнес; Дизайн и графика; Интернет-СМИ; Дизайн и графика; Дизайнер"
м,1.1.1986,,"Фан-сообщество; Кино; Фан-сообщество; Кино; Фильм; Мультфильм; Метал; Фото- и видеосъёмка; Интеллектуальные игры; Творчество; Фото- и видеосъёмка; Другая музыка; Дизайн и графика; Мебель; Поиск работы; Товары для творчества; Дизайн и графика; Музыкальная группа; Фото- и видеосъёмка; Бар, паб"
м,7.3.1988,Екатеринбург,
м,,,
м,,Тирасполь,"ВКонтакте; Кино; История; Закрытое сообщество; Творчество; Дизайн и графика; Стиль, одежда, обувь; Обучающие курсы; Видеоигра; Другие виды спорта; Активный отдых; Страна; Блогер; Техника, электроника; Молодёжное движение; История; Творчество; Телеканал; Объявления; Место отдыха"
м,,Москва,"Юмор; Бизнес; Общественная организация; Наука; Юмор; Интернет-СМИ; Образование; Интернет-СМИ; Домашние и дикие животные; Бизнес; Одежда, обувь; Культура; Наука; Туризм, путешествия; Городское сообщество; Знакомства; Наука; Интернет-СМИ; Сайты; Дизайн и графика"
ж,10.9.1987,Борок,Юмор; Домашние и дикие животные; Юмор; Юмор; Здоровый образ жизни; ВКонтакте; Интернет-СМИ; Сайты; Государственная организация; Юмор; Активный отдых; Домашние и дикие животные; Юмор; Художник; Интернет-провайдер; История; Творчество; Медицина; Образование; Общество
м,,Ульяновск,
м,,Самара,"Юмор; Фотография; Боевые искусства; Боевые искусства; Философия; Спортивная организация; Юмор; Юмор; Юмор; Боевые искусства; Юмор; Фотография; Дизайн интерьера; Юмор; Музей, галерея, выставка; Дискуссионный клуб; Творчество; Юмор; Эротика; Юмор"
ж,,Санкт-Петербург,Юмор; Творчество; Культура; Городское сообщество; Городское сообщество; Городское сообщество; Кино; Кинотеатр; Творчество; Фото- и видеосъёмка; Творчество; Культура; Творчество; Интернет-СМИ; Городское сообщество; Дизайн и графика; Дизайн интерьера; Творчество; Образование; Писатель
м,,Москва,
ж,19.1.1993,Москва,
ж,,Санкт-Петербург,
м,12.2.1987,Санкт-Петербург,"Игра; Другие товары; Видеоигры; Танцевальная музыка; Интернет-СМИ; Интернет-СМИ; Видеоигры; Техника, электроника; Фан-сообщество; Видеоигры; Видеоигры; Интернет-СМИ; Юмор; Юмор; Компьютерные услуги; Программное обеспечение; Юмор; Видеоигры; Юмор; Видеоигра"
м,19.7.1990,Новосибирск,"Юмор; Культура; Юмор; Образование; Юмор; Юмор; Юмор; Юмор; Юмор; Юмор; Юмор; Юмор; Юмор; Юмор; Юмор; Юмор; Юмор; Интернет-СМИ; Музей, галерея, выставка; Видеоигры"
ж,,Санкт-Петербург,
м,13.11.1987,Пермь,Приложение; Видеоигра; Видеоигры; Киберспортивная организация; Видеоигры; Творчество; Видеоигры; Видеоигры; Художник; Фитнес; Компьютерные услуги; Программирование; Духовное лицо; Блогер; Программное обеспечение; ВКонтакте; Стример; Печатное издание; Видеоигры; Реклама
м,,Балаково,
м,,Миасс,"Консалтинг, бизнес-услуги; Общество; Молодёжное движение; Предприниматель или предпринимательница; Общество; Образование; Общественная организация; Образование; Образование; Медицинский центр; Интернет-СМИ; Банк, финансовое учреждение; Благотворительная организация; Психология; Бизнес; Творчество; Культура; Туризм, путешествия; Культура; Философия"
ж,5.8.1988,Москва,
м,,,
м,,,"Настольные игры; Фан-сообщество; Образование; Настольные игры; Игры, игрушки; Настольные игры; Настольные игры; Настольные игры; Другие хобби; Игры; Настольные игры; Настольные игры; Государственная организация; Городское сообщество; Настольные игры; Государственная организация; Настольные игры; Настольные игры; Творчество; Онлайн-игра"
ж,,Самара,"Культура; Кино; Творчество; Кино; Творчество; Организация праздников; Дизайн и графика; Театр; Обучающие курсы; Музей, галерея, выставка; Классическая музыка; Танцы; Танцевальная школа; Джаз; Кино; Стиль, мода; Культурный центр; Джаз; Городское сообщество; Латиноамериканская музыка"
ж,,Москва,Юмор; Знакомства; Юмор; Кулинария; Музыкант; Юмор; Творчество; Фотография; Домашние и дикие животные; Поэт или поэтесса; Зоопарк; Фотография; Юмор; Музыкальная группа; Юмор; Домашние и дикие животные; Дизайн и графика; Творчество; Закрытое сообщество; Театр
м,7.6.1989,Плесецк,"Рок; Юмор; Юмор; Юмор; Блогер; Парк отдыха; Медицинская услуга; Культура; Музыкальный лейбл; Страна; Интернет-СМИ; Военное дело; Блог; Наука; Строительство, ремонт; Фильм; Группа коллег; Рок; Литература; Музыкальные инструменты"
м,,,
м,,Москва,Культура; Образование; Дизайн и графика; Медицина; Юмор; Наука; Образование; Юмор; Дизайн интерьера; Литература; Наука; Философия; Фан-сообщество; Юмор; Электронная музыка; Культурный центр; Фан-сообщество; Дискуссионный клуб; Юмор; Наука
м,,,Фотография; Молодёжное движение; Фотография; Фотограф; Фотограф; Фото- и видеосъёмка; Фотография; Творчество; Кино; Фотография; Фотография; Творчество; Фотограф; Фотография; Фотограф; Фотограф; Фотография; Кино; Фотограф; Фото- и видеосъёмка
м,,Архангельск,"Продукты питания, напитки; Доставка еды; Другие товары; Домашние и дикие животные; Недвижимость; Салон красоты; Товары для праздников; Общественная организация; Другие товары; Салон красоты; Товары для дачи, огорода; Товары для дачи, огорода; Салон красоты; Салон красоты; Знакомства; Клининг; Интернет-СМИ; Блогер; Объявления; Футбол"
м,,Нижний Новгород,"Мебель; Психология; Интернет-СМИ; Творчество; Юмор; Бизнес; Фотография; Культурный центр; Городское сообщество; Строительство, ремонт; Философия; Юмор; Юмор; Садоводство; Фотография; Юмор; Наука; Объявления; Туризм, путешествия; Интернет-СМИ"
м,30.4.1987,Апатиты,
м,,Санкт-Петербург,
м,,Москва,
м,17.9.1988,Ижевск,
м,,Санкт-Петербург,Фотография; Фотография; Фотография; Фотография; Фотография; Фотография; История; Публичная страница; Блогер; Актёр; Кино; Творчество; Городское сообщество; Фотография; Кино; Театр; Фотография; Кино; Поэт; Юмор
ж,,Воронеж,"Видеоигры; Другие хобби; Интернет-СМИ; Видеоигры; Стиль, одежда, обувь; Печатное издание; Другие хобби; Игры; Культура; Блог; Городское сообщество; Городское сообщество; Игры; Сайты; Дизайн и графика; Другие хобби; Видеоигры; Творчество; Анимация; Другие хобби"
