sex,bdate,city,groups_activities
м,,Москва,Образование; Образование; Программное обеспечение; Культура; Творчество; Образование; Обучающие курсы; Сайты; Рок; Культурный центр; Кино; Дизайн и графика; Видеоигры; Творчество; Дополнительное образование; Образование; Дизайн и графика; Дизайн и графика; Дизайн и графика; Дискуссионный клуб
м,23.4.1990,Ярославль,
м,12.3.1992,Москва,История; История; Юмор; Интернет-СМИ; ВКонтакте; Юмор; ВКонтакте; Блогер; Кино; Видеоигры; Государственная организация; Юмор; Домашние и дикие животные; Образование; Интернет-СМИ; Наука; Юмор; Библиотека; Закрытое сообщество; Наука
ж,30.11.1990,Москва,"Культура; Консалтинг, бизнес-услуги; Творчество; Консалтинг, бизнес-услуги; Реклама; Бизнес; Фотография; Туризм, путешествия; Блогер; Садоводство; Дизайн-студия; Обмен музыкой; Шоу, передача; Фотограф; Веб-студия; Веб-студия; Консалтинг, бизнес-услуги; Блог; Интернет-СМИ; Дизайн и графика"
ж,,Санкт-Петербург,
ж,,Мурманск,"Государственная организация; Кинотеатр; Образование; Туризм; Фотография; Салон красоты; Украшения, бижутерия ; Домашние и дикие животные; Ведущая; Туризм, путешествия; Юмор; Библиотека; Уход за собой; Туризм, путешествия; Творчество; Кино; Дополнительное образование; Туризм, путешествия; Государственная организация; Объявления"
м,,,
м,22.9.1980,Москва,"Городское сообщество; Родители и дети; Кино; Фан-сообщество; Образование; Юмор; Активный отдых; Интернет-СМИ; Образование; Образование; Юмор; Творчество; Туризм, путешествия; Образование; Юмор; Домашние и дикие животные; Фестиваль; Городское сообщество; Психология; Юмор"
м,5.2.1990,Санкт-Петербург,"Бизнес; Музыкальные инструменты; Фотография; Музыка; Городское сообщество; Творчество; Творчество; R&B; Дом культуры; Услуги для автовладельцев; Кино; Философия; Здоровый образ жизни; Фото- и видеосъёмка; Одежда, обувь; Творчество; Одежда, обувь; Туризм, путешествия; Видеоигра; Музыкант"
м,,Москва,"Компьютерная техника; Компьютерная техника; Техника, электроника; Интернет-СМИ; Игры; Видеоигры; Стиль, мода; Компьютерная техника; Техника, электроника; Другие хобби; Электроника; Техника, электроника; Наука; Обмен музыкой; Молодёжное движение; Здоровый образ жизни; Театр; Игры; Юмор; Видеоигры"
ж,,,"Кино; Юмор; Интернет-СМИ; Творчество; Городское сообщество; Юмор; Культурный центр; Юмор; Юмор; Косметология; Астрология, эзотерика; Писательница; Философия; Библиотека; Фотография; Архив; Молодёжное движение; Культура; Астрология, эзотерика; История"
ж,26.7.1989,Екатеринбург,"Образование; Городское сообщество; Городское сообщество; Домашние и дикие животные; Кино; Кино; Студия звукозаписи; Интернет-СМИ; Здоровый образ жизни; Кино; Домашние и дикие животные; Фотография; Театр; Техника, электроника; Фото- и видеосъёмка; Литература; Интернет-СМИ; Туризм, путешествия; Телеканал; Юмор"
м,,,"Юмор; Дизайн и графика; Приложение; Творчество; Книга; Домашние и дикие животные; Одежда, обувь; Шоу, передача; Шоу, передача; Страна; Публичная страница; Реклама; Бизнес; Финансы; Книга; Обучающие курсы"
м,8.6.1983,,"Шоу, передача; Фотография; Тренинг, семинар; Культурный центр; Культурный центр; Книга; Литература; Литература; Творчество; Игры; Фотография; Настольные игры; Благотворительная организация; Сайт; Фотограф; Туризм, путешествия; Другая музыка; Видеоигра; Фотография"
м,,,История; Творчество; Фан-сообщество; Творчество; История; Образование; Литература; Публичная страница; Наука
ж,16.12.1901,,
м,29.8.1982,Хабаровск,"Бизнес; ВКонтакте; ВКонтакте; Отношения полов; Юмор; Бизнес; Видеоигры; Образование; Образование; Юмор; Эротика; Техника, электроника; Печатное издание; Закрытое сообщество; Фотография; Приложение; Творчество; Кино; Эротика; Программирование"
ж,,Москва,"Художница; Продукты питания, напитки; Общественная организация; Консалтинг, бизнес-услуги; Творчество; Блогер; Кулинария; Приложение; Блогер; Бизнес; Родители и дети; Образование; Бассейн; Блог; Родители и дети; Обучающие курсы; ВКонтакте; Дополнительное образование; Поиск работы; Реклама"
м,,,
м,10.10.1988,Челябинск,
ж,,Santa Cruz de Tenerife,"Государственная организация; Литература; Астрология, эзотерика; Юмор; Литература; Знакомства; Домашние и дикие животные; Туризм, путешествия; Родители и дети; Юмор; Литература; Юмор; Юмор; Юмор; Образование; Туризм, путешествия; Дискуссионный клуб; Юмор; Место отдыха; Юмор"
м,,Москва,"Интернет-СМИ; Интернет-СМИ; Интернет-СМИ; Интернет-СМИ; Студия звукозаписи; Игры; Шоу, передача; Дизайн и графика; Видеоигры; Кино; Видеоигры; Дизайн и графика; Фотограф; Блог; Образование; Городское сообщество; Творчество; Образование; Видеоигры; Видеоигры"
м,,Санкт-Петербург,"Художник или художница; Интернет-СМИ; Интернет-СМИ; Одежда, обувь; Дизайнер; Юмор; Творчество; Творчество; Фан-сообщество; Программное обеспечение; Программирование; Программирование; Наука; Фан-сообщество; Творчество; Дизайн и графика; Стример; Творчество; Техника, электроника; Техника, электроника"
м,,Самара,"Электроника; Игры; Юмор; Игры; Техника, электроника; Кино; Наука; Бизнес; История; Фотография; Спортивные товары; Кино; Фотография; Шоу, передача; Одежда, обувь; Творчество; Туризм, путешествия; Спортивные товары; Фан-сообщество; Электроника"
м,15.1.1989,,Сайты; Видеоигры; Студия звукозаписи; Образование; Настольные игры; Видеоигры; Настольные игры; Рок; Видеоигры; Настольные игры; Другие товары; Настольные игры; Юмор; Киберспортсмен; Творчество; Игровая студия; Настольные игры; Кофейня; Фитнес; Творчество
ж,,Санкт-Петербург,
м,,,"Образование; Техника, электроника; Блогер; Интернет-СМИ; Садоводство; Юмор; Строительство, ремонт; Стример; Кино; Городское сообщество; Анимация; Интернет-СМИ; Кино; Военное дело; Военное дело; Кино; Техника, электроника; Объявления; Образование; Кино"
ж,,Минск,
м,15.9.1976,Москва,"Юмор; Кино; Кино; Дизайн и графика; Туризм, путешествия; Сайты; Дизайн и графика; Дискуссионный клуб; Дизайн и графика; Образование; Кино; Кино; Домашние и дикие животные; Культура; Юмор; Интернет-СМИ; Дизайн и графика; Стиль, одежда, обувь; Фотография; Кино"
м,,Тамбов,Культура; Настольные игры; Страна; Юмор; Дизайн и графика; Программное обеспечение; Настольные игры; Настольные игры; Настольные игры; Художник; Онлайн-игра; Юмор; Наука; Обучающие курсы; Дискуссионный клуб; Другие товары; Видеоигры; Фотография; Радиостанция; Модель
м,,,"Кино; Кино; Товары для дома; Кино; Образование; Фото- и видеосъёмка; Культура; Дизайн и графика; Туризм, путешествия; Интернет-СМИ; Кино; Продукты питания, напитки; Кино; Стиль, одежда, обувь; Активный отдых; Дизайн и графика; Творчество; Фотография; Городское сообщество; Творчество"
м,15.7.1989,Екатеринбург,"Юмор; Творчество; Юмор; Дизайн и графика; Творчество; Дизайн и графика; Дизайн интерьера; Реклама; Строительство, ремонт; Дизайн интерьера; Реклама; Реклама; Творчество; Дизайн интерьера; Кино; Дизайн интерьера; Дизайн интерьера; Юмор; Сайты; Юмор"
м,10.4.1980,Москва,"Юмор; Политика; История; Игры; Юмор; Общество; Домашние и дикие животные; Творчество; Библиотека; Видеоигра; Фотография; Наука; Юмор; Бар, паб; Отношения полов; Дискуссионный клуб; Блогер; Рок; Бизнес"
м,,Балашиха,Юмор; Образование; Юмор; Юмор; Модель; Анимация; Юмор; Творчество; Вымышленный персонаж; Модель; Театр; Другие хобби; Программирование; Модель; Модель; Ролевые игры; Программирование; Блогер; Юмор; Программирование
м,,Москва,"Интернет-СМИ; Боевые искусства; Кино; Фото- и видеосъёмка; Фото- и видеосъёмка; Музыкальная группа; Творчество; Боевые искусства; Музыкальная группа; Спортивный клуб; Здоровый образ жизни; Боевые искусства; Боевые искусства; Финансы; Фото- и видеосъёмка; Рок; Дополнительное образование; Художник или художница; Одежда, обувь; Страна"
ж,,Melbourne,"Электронная музыка; DJ; Музыкант; Творчество; Музей, галерея, выставка; Ночной клуб; Электронная музыка; Музыкант; Организация праздников; Электронная музыка; Радиостанция; Электронная музыка; DJ; Общество; Образование; Музыкальная группа; Электронная музыка; Творческое объединение; Наука; Образование"
м,6.4.1988,Москва,"Фотография; Кино; Туризм, путешествия; Фотография; Культура; Фотограф; Туризм, путешествия; Фотография; Наука; Фотография; Образование; Другие товары; Городское сообщество; Наука; Фан-сообщество; Учёный, преподаватель; Техника, электроника; Производство, промышленность; Художник; Строительство, ремонт"
м,,,"Электронная музыка; Фотография; Публичная страница; Другие хобби; Дизайн и графика; Дизайн и графика; Фотография; Интернет-СМИ; Юмор; Фотография; Электронная музыка; Фотография; Видеоигры; Туризм, путешествия; Творчество; Наука; Творчество; Дизайн и графика; Автомобили; Приложение"
ж,,Санкт-Петербург,"Творчество; Фотография; Объявления; Фото- и видеосъёмка; Фотография; Фото- и видеосъёмка; Фото- и видеосъёмка; Фото- и видеосъёмка; Стилист, имиджмейкер; Электроника; Одежда, обувь; Творчество; Фитнес; Фото- и видеосъёмка; Музыкальная группа; Объявления; Фотография; Программное обеспечение; Автомобили; Культура"
м,21.6.1982,Москва,
ж,,Ялта,"Городское сообщество; Туризм, путешествия; Фотография; Молодёжное движение; Реклама; Спортивные товары; Спортивная одежда и обувь; Блогер; Туризм, путешествия; Одежда, обувь; Кино; Продукты питания, напитки; Товары для животных; Цветы; Активный отдых; Шоу, передача; Дизайн-студия; Туризм, путешествия; Активный отдых; Творчество"
м,,Екатеринбург,"Кино; Дом культуры; Недвижимость; Наука; Кино; Городское сообщество; Юмор; Кино; Культурный центр; Юмор; Городское сообщество; Городское сообщество; Кино; Строительство, ремонт; Дизайн и графика; Юмор; Юмор; Интернет-СМИ; Кино; Юмор"
ж,29.1.1983,Омск,"Юмор; Творчество; Образование; Юмор; Художник или художница; Юмор; Видеоигры; Городское сообщество; Видеоигра; Юмор; Видеоигры; Игры; Юмор; Художник или художница; Видеоигра; Одежда, обувь; Фан-сообщество; Ролевые игры; Ролевые игры; Творчество"
м,14.11.1989,Барнаул,"Шоу, передача; Кино; Медицина; Баскетбол; Видеоигры; Поиск работы; Спортивная организация; Творчество; Домашние и дикие животные; Электронная музыка; Танцевальная музыка; Образование; Программирование; Спортсмен; Юмор; Юмор; Художник; Стример; Футбольная команда; Культурный центр"
ж,,Краснодар,"Художница; Дизайн и графика; Дизайн и графика; История; Музей, галерея, выставка; Дизайн-студия; Творчество; Обучающие курсы; Музей, галерея, выставка; Творчество; Предприниматель; Культура; Творчество; Музей, галерея, выставка; Творчество; Художник; Культурный центр; Художница; Творчество; Объявления"
м,,,"Дискуссионный клуб; Дискуссионный клуб; Интернет-СМИ; Интернет-СМИ; Футбол; Стример; Автоспорт; Кино; Бизнес; Фотография; Реклама; Автоспорт; Другие виды спорта; Образование; Одежда, обувь; Автомобили; Футбольная команда; Дизайн и графика; Публичная страница; Фотография"
м,11.7.1989,Нижний Новгород,
м,,,
м,,Санкт-Петербург,"Фотограф; Дизайн и графика; Фотограф; Дизайн и графика; Закрытое сообщество; Одежда, обувь; Другие товары; Настольные игры; Творчество; Художница; Метал; Дизайн и графика; Дизайн и графика; Художница; Дизайн и графика; Другие хобби; Фотограф; Дизайн и графика; Фотография; Другие хобби"
ж,10.5.1991,Москва,"Театр; Дом культуры; Художник или художница; Мототехника; Одежда, обувь; Одежда, обувь; Пошив и ремонт одежды; Строительные и ремонтные работы; Украшения, бижутерия ; Художница; Строительство, ремонт; Культура; Кулинария, рецепты; Кино; Зоопарк; Активный отдых; Видеоигры; Другие хобби; Парфюмерия, косметика; Музыкальная группа"
м,,Тверь,"Интернет-СМИ; Настольные игры; Интернет-СМИ; Юмор; История; Культура; Творчество; Дискуссионный клуб; Музей, галерея, выставка; История; Товары для творчества; Интернет-СМИ; Литература; История; Туризм, путешествия; Городское сообщество; Другие хобби; Творчество; Художник; Юмор"
м,12.8.1989,,"Дизайн и графика; Интернет-СМИ; Шоу, передача; Игры; Интернет-СМИ; Юмор; Юмор; Фотография; Анимация; Видеоигры; Юмор; Шоу, передача; Юмор; Кино; Юмор; Фотография; Фотография; Отношения полов; Городское сообщество; Творчество"
м,21.10.1985,Москва,"Творчество; Кино; Ювелирные изделия; Художник; Техника, электроника; Хостинг, регистрация доменов; Дизайн и графика; Языки; Дизайн и графика; Программирование; Хостинг, регистрация доменов; Товары для творчества; Певица; Техника, электроника; ВКонтакте; Дизайн и графика; Дизайн и графика; Здоровый образ жизни; Игры, игрушки; Программирование"
м,18.4.1981,Москва,"Сайты; Городское сообщество; Домашние и дикие животные; Приложение; Шоу, передача; Юмор; Образование; Дискуссионный клуб; Мобильные технологии; Интернет-СМИ; Домашние и дикие животные; Образование; Интернет-СМИ; Игры; Туризм, путешествия; История; Юмор; Дизайн и графика; Культура; Фотография"
м,,Краснодар,"Техника, электроника; Бизнес; Программное обеспечение; Техника, электроника; Военное дело; Автовладельцы; Публичная страница; Юридические услуги; Предприниматель; Туризм, путешествия; Строительство, ремонт; Автовладельцы; Городское сообщество; Дизайн и графика; Бизнес; Шоу, передача; Отдых на природе; Интернет-СМИ; Строительство, ремонт; Кино"
м,,,"Игры; Интернет-СМИ; Юмор; Производство, промышленность; Композитор; Дизайн и графика; Образование; Творчество; Кино; Дизайн и графика; Фан-сообщество; Блог; Военное дело; Военное дело; Военное дело; История; Кино; Обучающие курсы; Стиль, мода; Фотография"
м,,Кемерово,Юмор; Юмор; Культура; Фотография; Фотография; Фотография; Автомобили; Ролевые игры; Доставка еды; Юмор; Фотография; Творчество; Культурный центр; Культура; Творчество; Юмор; Театр; Фотография; Другие хобби; Фотография
м,,Москва,Наука; Творчество; Наука; Дискуссионный клуб; Кино; Юмор; Музыкальная группа; Философия; Творчество; Юмор; Электронная музыка; Публичная страница; Юмор; Образование; Юмор; Музыкальная группа; Культура; Музыкальная группа; Творчество; Комик
м,,,Юмор; Дизайн и графика; Дизайн и графика; Библиотека; Философия; Видеоигра; Дизайн и графика; Дизайн и графика; Культура; Юмор; Фотография; Юмор; История; Наука; Художник; Юмор; Творчество; Юмор; Юмор; Дизайн и графика
м,,,Рок; Юмор; Наука; Дискуссионный клуб; Велосипеды; Автомобили; Творчество; Дизайн-студия; История; Политика; Юмор; Автомобили; Автомобили; Юмор; Электронная музыка; Фотография; Велосипеды; Военное дело; Культура; Футбол
м,11.1.1986,Петрозаводск,"Блог; Другие хобби; Общество; Творчество; Творчество; Интернет-СМИ; Фотография; Наука; Творчество; Санаторий, дом отдыха; Дизайн и графика; Юмор; Интернет-СМИ; Игры, игрушки; Игры; Интернет-СМИ; Юмор; История; Образование; Городское сообщество"
