sex,bdate,city,groups_activities
м,14.8.1982,Серпухов,"Фотография; Туризм, путешествия; Юмор; Стиль, одежда, обувь; Фотография; Творчество; Культура; Студия звукозаписи; Юмор; Стиль, одежда, обувь; Другая музыка; Культура; Культура; Творчество; Юмор; Юмор; Дискуссионный клуб; Юмор; Кино; Домашние и дикие животные"
м,,Санкт-Петербург,"Интернет-СМИ; Поиск работы; Городское сообщество; Кинотеатр; Другая музыка; Кинотеатр; Туризм, путешествия; Кино; Блогер; Кулинария, рецепты; Государственная организация; Другая музыка; Поиск работы; Фотография; Шоу, передача; Творчество; История; Техника, электроника; Культурный центр; Кулинария, рецепты"
м,,Тула,Образование; Фан-сообщество; Кино; Молодёжное движение; Дизайн и графика; Дом культуры; Фотография; Фотография; Фотография; Городское сообщество; Фотография; Творчество; Фотография; Блог; Футбол; Интернет-СМИ; Фотография; Юмор; Фото- и видеосъёмка; Образование
м,,Москва,"Эротика; Интернет-СМИ; Другие хобби; Объявления; Школа; Творчество; Юмор; Дизайн и графика; Религиозное учреждение; Юмор; Товары для дома; Творчество; Стиль, мода; Дизайн-студия; Творчество; Домашние и дикие животные; Музыка; Стиль, одежда, обувь; Вымышленный персонаж; Юмор"
ж,18.10.1990,Москва,"Юмор; Юмор; Интернет-СМИ; Юмор; Образование; Юмор; Религия; Городское сообщество; Философия; Стиль, одежда, обувь; Домашние и дикие животные; Творчество; Медицина; Медицина; Юмор; Образование; Фотография; Одежда, обувь; Творчество; Фотография"
ж,,Новобейсугская,
ж,,,
ж,22.10.1993,Москва,"Юмор; Юмор; Кино; Блогер; Писатель; Юмор; Объявления; Дискуссионный клуб; Техника, электроника; Политика; Игры; Интернет-СМИ; Стример; Юмор; Интернет-СМИ; Юмор; Юмор; Образование; Шоу, передача; Юмор"
ж,,Ярославль,
ж,,Санкт-Петербург,
ж,,Санкт-Петербург,"Шоу, передача; Художник или художница; Украшения, бижутерия ; Одежда, обувь; Культурный центр; Программное обеспечение; Родители и дети; Образование; Дизайн-студия; Медицинский центр; Образование; Кофейня; Обучающие курсы; Бизнес; Кино; Творчество; Шоу, передача; Здоровый образ жизни; Культурный центр; Культурный центр"
ж,,,"Общественная организация; Интернет-СМИ; Садоводство; Родители и дети; Дизайн интерьера; Городское сообщество; Культура; Образование; Другая музыка; Общество; Творчество; Родители и дети; Музыкант; Интернет-СМИ; Образование; Образование; Шоу, передача; Недвижимость; Государственная организация; Дополнительное образование"
м,,Донецк,Фотография; Творчество; Знакомства; Дискуссионный клуб; Наука; Автовладельцы; Видеоигры; Эротика; Наука; Модель; Стример; Модель; Юмор; Кино; Бизнес; Творчество; Дискуссионный клуб; Творчество; Обмен музыкой; Юмор
м,,,
ж,,Москва,
м,,Ижевск,
ж,,Москва,"Кино; Кино; Кулинария, рецепты; Юмор; Юмор; Юмор; Кулинария, рецепты; Юмор; Творчество; Юмор; Кулинария, рецепты; Уход за собой; Кино; Уход за собой; Юмор; Здоровый образ жизни; Уход за собой; Образование; Садоводство; Юмор"
м,1.5.1978,Санкт-Петербург,Юмор; Литература; Фотография; Образование; Наука; Кино; Образование; Дизайн и графика; Образование; Юмор; Общество; Наука; Наука; Юмор; Юмор; Финансы; Обучающие курсы; Бизнес; Образование; Городское сообщество
м,,,
м,,Москва,"Объявления; Знакомства; Творчество; Стиль, одежда, обувь; Знакомства; Туры, экскурсии; Объявления; Шоу, передача; История; Знакомства; Блогер; Знакомства; Парфюмерия, косметика; Фотография; Знакомства; Объявления; Общественная организация; Туризм, путешествия; Туризм, путешествия; Знакомства"
м,25.4.1988,,"Кино; Футбол; Шоу, передача; Наука; Телеканал; Городское сообщество; Дизайн и графика; Игры; Юмор; Игры; Юмор; Дискуссионный клуб; Видеоигры; Домашние и дикие животные; Юмор; Культура; Объявления; Видеоигры; Телеканал; Шоу, передача"
м,28.5.1983,,
м,,Matsudo,
м,13.1.1989,Нижний Новгород,"Анимация; Городское сообщество; Интернет-СМИ; Другие товары; Видеоигры; Творчество; Автомобили; Наука; Городское сообщество; Программное обеспечение; Наука; Веб-студия; Наука; Торгово-развлекательный центр; Блогер; Политик, госслужащий; Интернет-СМИ; Музыкальная группа; Домашние и дикие животные"
ж,,Москва,"Интеллектуальные игры; Творчество; Образование; Туризм, путешествия; Литература; Образование; Творчество; Туризм, путешествия; Юмор; Городское сообщество; Другие хобби; Дизайн и графика; Фан-сообщество; Кино; Творчество; Юмор; Наука; Дизайн и графика; Туризм, путешествия; Творчество"
м,11.12.1990,Москва,Дискуссионный клуб; Автомобили; Интернет-СМИ; Блогер; Городское сообщество; Боевые искусства; Дискуссионный клуб; Юмор; Общественный деятель; Домашние и дикие животные; Интернет-СМИ; Кино; Интернет-СМИ; Юмор; Городское сообщество; Дискуссионный клуб; Творчество; Печатное издание; Городское сообщество; Языки
м,,Санкт-Петербург,
ж,,Москва,"Другие хобби; Городское сообщество; Кино; Образование; Диеты, здоровое питание; Наука; Домашние и дикие животные; Приложение; Видеоигры; Творчество; Юмор; Музыкальная группа; Дизайн и графика; Анимация; Юмор; Творчество; Юмор; Кино; Юмор; Кино"
ж,,,
ж,,Тверь,"Доставка еды; Городское сообщество; Интернет-СМИ; Видеоигра; Программирование; Городское сообщество; Дизайн и графика; Видеоигры; Кулинария, рецепты; Видеоигра; Видеоигры; Творчество; Видеоигры; Бизнес; Игры; Видеоигра; Художница; Художник; Художница; Городское сообщество"
ж,,,"Общество; Общество; Культурный центр; Соседи; Музыкант; Кино; Кино; Кино; Кино; Театр; Здоровый образ жизни; Фан-сообщество; Стилист, имиджмейкер; Дискуссионный клуб; Городское сообщество; Кино; Юмор; Блог; Кулинария, рецепты; Музей, галерея, выставка"
м,,Грозный,
м,2.9.1980,Рязань,"Интернет-СМИ; Интернет-СМИ; Стиль, одежда, обувь; Фан-сообщество; Интернет-СМИ; Юмор; Культура; Религия; Культура; Другие хобби; Фотография; Фотография; Литература; Религия; Туризм, путешествия; История; Религиозное учреждение; Фотограф; Фотограф; Творчество"
м,1.6.1986,Челябинск,"Городское сообщество; Приложение; Приложение; Футбол; Кино; Кафе, ресторан; Городское сообщество; Юмор; Комик; Строительство, ремонт; Кино; Образование; Литература; Дизайн интерьера; Товары для детей; Наука; Творчество; Доставка еды; Соседи; Соседи"
м,,Москва,"Интернет-СМИ; Интернет-СМИ; Писатель; Писатель; Юмор; Юмор; Кино; Творчество; Юмор; Городское сообщество; Туризм, путешествия; Юмор; Психология; Видеоигры; Программирование; Интернет-СМИ; Литература; Образование; Юмор; Зоопарк"
м,,Москва,
ж,5.9.1987,Kinsale,Дизайн и графика; Видеоигра; Сериал; Объявления; Другая музыка; Кино; Творчество; Творчество; Кино; Художник или художница; Творчество; Кино; Литература; История; Художник или художница; Творчество; Творчество; Художник или художница; Творчество; Культура
м,,Москва,"Юмор; Творчество; Писатель или писательница; История; Юмор; Творчество; Видеоигры; Ролевые игры; Политика; Юмор; Видеоигры; Домашние и дикие животные; Танцор, танцовщица; Фотография; Здоровый образ жизни; Государственная организация; Видеоигры; Юмор; Интернет-СМИ; ВКонтакте"
м,22.10.1992,Санкт-Петербург,"Фан-сообщество; Юмор; Финансы; Игры; Интернет-СМИ; Интернет-СМИ; Фотография; Наука; Видеоигры; Городское сообщество; Анимация; Музей, галерея, выставка; Фан-сообщество; Юмор; Музыка; История; Юмор; Культура; Творчество; Анимация"
м,23.1.1986,Санкт-Петербург,Художница; История; История; Блогер; Художник; Видеоигры; Модель; Фан-сообщество; Творчество; Творчество; Другие виды спорта; Фан-сообщество; Фан-сообщество; Комик; Видеоигры; Музыкальная группа; Наука; Музыкант; Музыкальная группа; Музыка
м,,Екатеринбург,"Другие виды спорта; Художник или художница; Другие товары; Другие виды спорта; Производство, промышленность; Другие хобби; Другие товары; Активный отдых; Производство, промышленность; Спортивная организация; Туризм, путешествия; Фотография; Фотография; Производство, промышленность; Психолог; Туризм, путешествия; Музыкальная группа; Товары для творчества; Товары для творчества; Игры"
м,,,
м,15.2.1987,Москва,
м,26.4.1966,Москва,"Здоровый образ жизни; История; Культура; Туризм, путешествия; Психология; Юмор; Медицинский центр; История; Психология; Образование; Образование; Городское сообщество; История; Юмор; Бизнес; Ролевые игры; Журналист; Фотография; Творчество; Наука"
м,,Los Angeles,"Юмор; Фан-сообщество; Юмор; Интернет-СМИ; Кино; Юмор; Видеоигры; Видеоигры; Видеоигры; Юмор; Программирование; Юмор; Шоу, передача; Юмор; Видеоигры; Творчество; Юмор; Другая музыка; Игры, игрушки; Рок"
м,7.1.1986,Самара,"Видеоигры; Игры, игрушки; Интернет-СМИ; Кино; Товары для праздников; Видеоигры; Литература; Метал; Рыбалка; Программирование; Видеоигры; Видеоигры; Видеоигры; Видеоигра; Литература; Книга; Творчество; Видеоигры; Видеоигра; Активный отдых"
м,2.12.1989,Фрязино,Юмор; Городское сообщество; Наука; Юмор; Юмор; Творчество; Компьютерная техника; Философия; Онлайн-игра; Литература; Культурный центр; Услуга
м,8.11.1988,Екатеринбург,"Интернет-СМИ; Кино; Городское сообщество; Интернет-СМИ; Юмор; Юмор; Интернет-СМИ; Юмор; Наука; Экстремальный спорт; Интернет-СМИ; Электронная музыка; Дизайнер; Парфюмерия, косметика; Творчество; Автосервис; Шоу, передача; Юмор; Мебель; Фестиваль"
м,24.7.1989,Москва,"Юмор; Домашние и дикие животные; Юмор; Юмор; Юмор; Юмор; Игры; Юмор; Юмор; Юмор; Юмор; Интернет-СМИ; Мобильные технологии; Фотография; История; Туризм, путешествия; Электроника; Объявления; Городское сообщество; Юмор"
м,13.10.1984,Саров,"Городское сообщество; Фотография; Фитнес; Дискуссионный клуб; Общественная организация; Фотография; Творчество; Кафе, ресторан; Образование; Творчество; Видеоигры; Фотография; Доставка еды; Творчество; Парк отдыха; Техника, электроника; Фотография; Доставка еды; Фитнес; Видеоигры"
м,31.8.1990,Москва,Домашние и дикие животные; Юмор; Интернет-СМИ; Другие хобби; Юмор; Юмор; Юмор; Интернет-СМИ; Цирк; Интернет-СМИ; Юмор; Культура; Домашние и дикие животные; Юмор; Юмор; Образование; Другие хобби; Спортивные товары; Домашние и дикие животные; Дом культуры
м,,Москва,"Творчество; Кино; Финансы; ВКонтакте; Кино; Кино; Кино; Наука; Литература; Кино; Юмор; Наука; Блог; Финансы; Образование; Интернет-СМИ; Юмор; Банк, финансовое учреждение; Литература; Творчество"
ж,30.4.1993,Москва,"Настольные игры; Блог; Настольные игры; Туризм, путешествия; Кино; Настольные игры; Настольные игры; Наука; Творчество; Настольные игры; История; Здоровый образ жизни; Образование; Настольные игры; Интернет-СМИ; Юмор; Фотография; История; Юмор; Кино"
м,29.1.1986,Санкт-Петербург,
м,23.6.1980,Новосибирск,"Настольные игры; Настольные игры; Настольные игры; Настольные игры; Настольные игры; Настольные игры; Настольные игры; Настольные игры; Настольные игры; Туризм, путешествия; Настольные игры; Настольные игры; Игры; Настольные игры; Фотография; Настольные игры; Настольные игры; Игры; Метал; Настольные игры"
ж,18.7.1991,Тула,"Фотография; Одежда, обувь; Кино; Кино; Дизайн интерьера; Кулинария, рецепты; Юмор; Отношения полов; Юмор; Кулинария; Образование; Дизайн интерьера; Банк, финансовое учреждение; Домашние и дикие животные; Юмор; Юмор; Литература; Творчество; Интернет-СМИ; Отношения полов"
ж,26.3.1991,,
ж,22.7.1987,Санкт-Петербург,
м,11.10.1991,Санкт-Петербург,"Общество; Образование; Философия; Философия; Литература; Бизнес; Городское сообщество; Сайты; Дизайн и графика; Стример; Интернет-СМИ; Образование; Творчество; Фотография; Украшения, бижутерия ; Дизайн и графика; Активный отдых; Фотография; Городское сообщество; Кафе, ресторан"
м,,,"Интернет-СМИ; Блог; Юмор; Городское сообщество; Интернет-СМИ; Фотография; Психология; Музыкант; Дизайнер; Предприниматель; Культура; Электронная музыка; Дизайнер; Интернет-СМИ; Стиль, одежда, обувь; Творчество; Образование; Сайты; Одежда, обувь; Интернет-СМИ"
м,,Санкт-Петербург,Творчество; Стример; Юмор; Интернет-СМИ; Юмор; Творчество; Интернет-СМИ; Интернет-СМИ; Творчество; Блогер; Здоровый образ жизни; Городское сообщество; Телеканал; Городское сообщество; Бизнес; Юмор; Юмор; Юмор; Юмор; Культура и искусство
м,,Москва,"Философия; Домашние и дикие животные; Кино; Городское сообщество; Кино; Культура; Юмор; Дом культуры; Юмор; Творчество; Бизнес; Электронная музыка; Юмор; Другая музыка; Другая музыка; Культура; Электронная музыка; Автомобили; Стиль, мода; Автомобили"
м,,Петрозаводск,"Юмор; Фотография; Фотография; Культура; Кафе, ресторан; Театр; Фотография; Кафе, ресторан; Другая музыка; Группа памяти; Фотография; Производство контента; Группа памяти; Образование; Театр; Творчество; Музыкант; Блог; Фотограф; Музыкальная группа"
м,24.12.1987,Нижний Новгород,Кофейня; Кино; Студия звукозаписи; Настольные игры; Объявления; Кино; Кино; Видеоигры; Место отдыха; Кино; Городское сообщество; Видеоигры; Настольные игры; Видеоигры; Интеллектуальные игры; Художник; Кино; Ролевые игры; Настольные игры; Кино
м,5.7.1989,Москва,Фотография; Городское сообщество; Блогер; Юмор; Юмор; Фотография; Юмор; Фотография; ВКонтакте; Юмор; Юмор; Страна; История; Юмор; Городское сообщество; Киберспортивная организация; Творчество; Общество; Юмор; Культура
м,,Екатеринбург,"Фото- и видеосъёмка; Футбол; Приложение; Бизнес; Кино; Фотография; Туризм, путешествия; Интернет-СМИ; Творчество; Интернет-СМИ; Фотография; Городское сообщество; Образование; Одежда, обувь; Фотография; Наука; Туризм, путешествия; Музыкальная группа; Оператор спутникового телевидения; Страна"
м,1.1.1976,Москва,
ж,13.10.1982,Москва,"Творчество; Певец или певица; Философия; Музыкант; Украшения, бижутерия ; Культурный центр; Литература; Дизайн и графика; Творчество; Творчество; Юмор; Учёный, преподаватель; Rap, Hip-Hop"
м,,,Юмор; Юмор; Общество; Культура; Юмор; Архив; Кино; Юмор; Юмор; Музыка; Юмор; Юмор; Культура; Юмор; Домашние и дикие животные; Юмор; Культура; Кино; Культурный центр; Другие хобби
ж,,Архангельск,Юмор; Домашние и дикие животные; Кино; Закрытое сообщество; Дизайн и графика; Наука; Городское сообщество; Домашние и дикие животные; Наука; Образование; Домашние и дикие животные; Городское сообщество; Творчество; Домашние и дикие животные; Домашние и дикие животные; Фан-сообщество; Публичная страница; Группа коллег; Производство контента; Ветеринарная клиника
м,,Томск,"Настольные игры; Бизнес; Место отдыха; Туризм, путешествия; Туры, экскурсии; Бизнес; Зимние виды спорта; Настольные игры; Настольные игры; Игры; Настольные игры; Настольные игры; Зимние виды спорта; Настольные игры; Настольные игры; Настольные игры; Юмор; Спортивный клуб; Настольные игры; Художник"
м,,Екатеринбург,Программирование; Образование; Фотография; Фотография; Дополнительное образование; Программирование; Образование; Программирование; Фотография; Творчество; Дизайн и графика; История; Фотография; Дизайн и графика; Программирование; Товары для творчества; Программирование; Программирование; Программирование; Эротика
