sex,bdate,city,groups_activities
ж,,Симферополь,"Домашние и дикие животные; Языки; Фан-сообщество; Здоровый образ жизни; Психология; Родители и дети; Кулинария, рецепты; Обучающие курсы; Общество; Родители и дети; Художница; Образование; Кино; Стиль, мода; Блогер; Философия; Здоровый образ жизни; Родители и дети; Юмор; Кулинария, рецепты"
м,,Самара,"Образование; Дискуссионный клуб; Юмор; Образование; Отношения полов; История; Туризм, путешествия; Политик, госслужащий; Врач; Бизнес; Родители и дети; Финансы; Приложение; Предприниматель; Блогер; Интернет-СМИ; Наука; Продукты питания, напитки; Строительные и ремонтные работы; Театр"
ж,,Ярославль,Поэт или поэтесса; Творчество; Радиостанция; Творчество; Юмор; Интернет-СМИ; Городское сообщество; Дизайн и графика; Знакомства; Юмор; Юмор; Здоровый образ жизни; Обучающие курсы; Интернет-СМИ; Литература; Творчество; Интернет-СМИ; Художник или художница; Городское сообщество; Дизайнер
м,,Москва,"Производство, промышленность; Боевые искусства; Анимация; Юмор; Юмор; Интернет-СМИ; Музей, галерея, выставка; Шоу, передача; Философия; Культура; История; Публичная страница; Культура; Юмор; Юмор; Юмор; Юмор; Творчество; Культура; Образование"
ж,,,
ж,14.2.1969,Санкт-Петербург,"Интеллектуальные игры; Благотворительность; Туризм, путешествия; Активный отдых; Дискуссионный клуб; Домашние и дикие животные; Астрология, эзотерика; Гостиница; Городское сообщество; Астрология, эзотерика; Городское сообщество; Юмор; Туристическое агентство; Цветы; Печатное издание; Юмор; Стиль, одежда, обувь; Другие товары; Философия; Интернет-СМИ"
м,30.7.1981,Москва,Политика; Фотография; Эротика; Дискуссионный клуб; Фотография; Юмор; Дом культуры; Онлайн-игра; Творчество; Общественный деятель; Фитнес; Автомобили; Творчество; Дизайн и графика; Видеоигры; Обучающие курсы; Дизайн и графика; Юмор; Юмор; Кино
ж,10.6.1996,Москва,"Танцы; Дизайн интерьера; Шоу, передача; Дизайн-студия; Творчество; Фотография; Строительство, ремонт; Дизайн интерьера; Стиль, одежда, обувь; Психология; Дизайн интерьера; Дизайн интерьера; Творчество; Творчество; Дизайн интерьера; Дизайн и графика; Интерьер; Образование; Дом культуры; Дизайн интерьера"
м,,Пермь,"Баскетбол; Кино; Фото- и видеосъёмка; Кафе, ресторан; Фотография; Зимние виды спорта; Шоу, передача; Стиль, одежда, обувь; Кино; Дом культуры; Фотограф; Шоу, передача; История; Стиль, мода; Бизнес; Фотография; Юмор; Предприниматель; Производство контента; Продукты питания, напитки"
м,,Магадан,
м,,Астана / Нур-Султан,
м,,,"Стиль, мода; Культура; Кино; Шоу, передача; Дом культуры; Юмор; Юмор; Товары для животных; Кино; Стиль, одежда, обувь; Культура; Творчество; Друзья; Фотография; Баскетбольная команда; Дискуссионный клуб; Юмор; Культура; Фотография; Молодёжное движение"
ж,,Москва,"Астрология, эзотерика; Стиль, мода; Стиль, мода; Творчество; Творчество; Творчество; Дизайн и графика; Рок; Образование; Школа; Домашние и дикие животные; Домашние и дикие животные; Домашние и дикие животные; Образование; Зоопарк; Творчество; Дизайн и графика; Творчество; Художница; Медицина"
м,10.4.1981,Красноярск,Юмор; Юмор; Юмор; Образование; Юмор; Философия; Философия; Юмор; Отношения полов; Юмор; Литература; Юмор; Юмор; Юмор; Юмор; Другие хобби; Философия; Философия; Философия; Блог
ж,,,"Творчество; Велосипеды; Национальный парк, заповедник; Творчество; Отдых на природе; Дизайнерская студия"
м,,Новороссийск,Игры; Видеоигры; Городское сообщество; Наука; Фотограф; Кино; Фотография; Творчество; Юмор; Фотография; Дизайн и графика; Музыкант; Фотограф; Фотограф; Фотография; Фотограф; Фото- и видеосъёмка; Фото- и видеосъёмка; Фото- и видеосъёмка; Фотография
ж,,Москва,"Юмор; Культура; Шоу, передача; Культура; Домашние и дикие животные; Медицина; Творчество; Творчество; Музей, галерея, выставка; Фотография; Фотография; Религиозное учреждение; Творчество; Творчество; Стиль, одежда, обувь; Автовладельцы; Философия; Литература; Фотография; Фотография"
м,11.11.1981,Сыктывкар,"Юмор; Музыка; Банк, финансовое учреждение; Культурный центр; Юмор; Издательский дом; Зоопарк; Бизнес; Кино; Дизайн и графика; Культура; Интернет-СМИ; Юмор; Образование; Дизайн и графика; Творчество; Джаз; Другая музыка; Образование; Творчество"
ж,1.6.1981,,
ж,,Пермь,
м,26.4.1985,,Видеоигра; Журналист; Игры; Видеоигры; Видеоигры; Видеоигры; Видеоигры; Творчество; Видеоигры; Творчество; Другая музыка; Видеоигры; Видеоигры; Модель; Творчество; Творчество; Видеоигры; Видеоигры; Видеоигры; Кино
ж,,Санкт-Петербург,"Благотворительная организация; Литература; Продукты питания, напитки; Культура; Домашние и дикие животные; Творчество; Благотворительная организация; Интернет-СМИ; Недвижимость; Отношения полов; Актёр; Наука; Домашние и дикие животные; Интернет-СМИ; Домашние и дикие животные; Домашние и дикие животные; Домашние и дикие животные; Комик; Домашние и дикие животные"
м,,,Городское сообщество; Интернет-СМИ; Блогер; Юмор; Видеоигры; Дискуссионный клуб; Городское сообщество; Юмор; Юмор; Юмор; Кино; Юмор; Видеоигры; Юмор; Творчество; Юмор; Домашние и дикие животные; Игры; Юмор; Игры
м,,,"Танцевальная музыка; Танцевальная музыка; Наука; Спортивная организация; Творчество; Строительство, ремонт; Фотография; Туризм, путешествия; Творчество; Наука; Наука; Творчество; Государственная организация; Строительство, ремонт; Астрология, эзотерика; Образование; Писатель или писательница; Строительство, ремонт; Хоккей; Место отдыха"
ж,,Москва,"Дизайнер; Образование; Государственная организация; Туризм, путешествия; Психология; Кулинария, рецепты; Ролевые игры; Фотография; Творчество; Соседи; Дискуссионный клуб; Страна; Поэт; Художник; Дизайнер; Дизайнер; Дизайн и графика; Дизайнер; Фотография; Дизайн интерьера"
м,,,"Техника, электроника; Строительство, ремонт; Кино; Дизайн интерьера; Фото- и видеосъёмка; Фотография; Строительство, ремонт; Интернет-СМИ; Строительство, ремонт; Дизайн и графика; Наука; Образование; Фотография; Городское сообщество; Фотография; Фотография; Фотография; Юмор; Юмор; Дизайн и графика"
м,,,
ж,,Москва,"Кулинария, рецепты; Кулинария, рецепты; Программное обеспечение; Городское сообщество; Дизайн и графика; Шоу, передача; Интернет-СМИ; Литература; Туризм, путешествия; Интернет-СМИ; Образование; Дизайн и графика; Туризм, путешествия; Дизайн и графика; Творчество; Творчество; Философия; Телеканал; Книга; Общество"
м,2.10.1984,Уфа,
м,,Санкт-Петербург,Юмор; Эротика; Юмор; Игры; Видеоигры; Юмор; Дизайн и графика; Творчество; Страна; Анимация; Юмор; Игры; Ролевые игры; Юмор; Анимация; Анимация; Творчество; Анимация; Анимация; Художник или художница
м,,Нижний Новгород,"Интернет-СМИ; Юмор; Творчество; Фото- и видеосъёмка; Юмор; Юмор; Знакомства; Бар, паб; Кафе, ресторан; Украшения, бижутерия ; Творчество; Фотография; Религиозное учреждение; Другие услуги; Литература; Городское сообщество; Библиотека; Бар, паб; Бар, паб; Одежда, обувь"
ж,8.10.1987,Уфа,Театр; Литература; Образование; Образование; Юмор; Молодёжное движение; Другие хобби; Литература; Философия; Юмор; Религия; Религия; Творчество; Религия; Религия; Общество; Религия; Юмор; Музыкант; Религия
м,,Керчь,"Видеоигра; Другие товары; Видеоигры; Боевые искусства; Видеоигры; Спортивная организация; Фотография; Одежда, обувь; Реклама; Блогер; Видеоигры; Компьютерная техника; Боевые искусства; Модель; Творчество; Фотография; Культура; Видеоигра; Видеоигры; Видеоигры"
м,,Клин,"Фотография; Обмен музыкой; Блогер; Юмор; Телеканал; Юмор; Электронная музыка; Автомобили; Юмор; Танцевальная музыка; История; Образование; Наука; Игры; Юмор; Автомобили; Игры; Наука; Шоу, передача; Юмор"
м,,Вологда,
м,,,"Фильм; Кино; Кинотеатр; Городское сообщество; Музыкальная группа; Фотограф; Дизайн и графика; Другая музыка; Юмор; Дополнительное образование; Мультфильм; Студия звукозаписи; Литература; Благотворительная организация; Кино; Культурный центр; Образование; Кино; Творчество; Кафе, ресторан"
м,,Новосибирск,"Юмор; Юмор; Юмор; Юмор; Образование; Юмор; История; Дизайн интерьера; Юмор; Творчество; Творчество; Водный спорт; Музей, галерея, выставка; Писатель; Юмор; Туризм, путешествия; Дом культуры; Рок; Велосипеды"
м,12.12.1987,Москва,Городское сообщество; Городское сообщество; Закрытое сообщество; Баскетбол; Образование; Городское сообщество; Другие хобби; Образование; Игры; Образование; Поиск работы; Интернет-СМИ; Городское сообщество; Блогер; Общество; Дополнительное образование; Образование; Культура; Творчество; Наука
м,28.8.1986,Вязьма,
м,18.6.1982,Североморск,"Интернет-СМИ; Финансы; Объявления; Дизайн и графика; Государственная организация; Туризм, путешествия; Анимация; Техника, электроника; Экономика и финансы; Видеоигры; Экстремальный спорт; Политика; Другие товары; Военное дело; Культура; Медицина; Игры; Активный отдых; Военное дело; Интернет-СМИ"
м,18.12.1985,Москва,"Организация праздников; Кино; Музыкальные инструменты; Дизайн и графика; Кино; Блогер; Творчество; Творчество; Обмен музыкой; Другая музыка; Музыкальные инструменты; Интернет-СМИ; Обмен музыкой; Музыкант; Обмен музыкой; Юмор; Фотография; Rap, Hip-Hop; Общество; Образование"
м,14.8.1983,Севастополь,Творчество; Дизайн и графика; Творчество; Городское сообщество; Наука; Юмор; Городское сообщество; Автовладельцы; Наука; Музыкальная группа; Городское сообщество; Автовладельцы; Городское сообщество; Юмор; Музыкальная группа; Танцевальная музыка; Наука; Городское сообщество; Музыкант; Городское сообщество
м,,,Дискуссионный клуб; Общественный деятель; Кино; Музыкальная группа; Юмор; Политика; Городское сообщество; Фан-сообщество; Анимация; Юмор; Юмор; Дискуссионный клуб; Домашние и дикие животные; Интернет-СМИ; Творчество; Юмор; Наука; Блог; Юмор; Рок
ж,,,"Объявления; Родители и дети; Городское сообщество; Городское сообщество; Медицинская услуга; Блог; Игры, игрушки; Родители и дети; Кино; Творчество; Печатное издание; Блогер; Литература; Поэтесса; Концерт; Фотография; Творчество; Творчество; Поэтесса; Танцевальная музыка"
ж,,Москва,"Кино; Кино; Кино; Кинотеатр; Кино; Кино; Кино; Юмор; Дизайн и графика; Фильм; Кино; Юридические услуги; Режиссёр, продюсер; Творчество; Журналист; Книжный магазин; Кино; Религия; Религия; Общественный деятель"
м,9.3.1981,Конаково,
м,19.12.1985,Вологда,"Отдых на природе; Юмор; Дизайн интерьера; Туры, экскурсии; Шоу, передача; Творчество; Фотография; Творчество; Дизайн и графика; Фильм; Строительство, ремонт; Психология; Строительство, ремонт; Оборудование; Видеоигра; Ювелирные изделия; Фильм; Домашние и дикие животные; Строительные материалы, инструменты; Государственная организация"
ж,,Москва,
ж,,Новосибирск,
ж,,Новосибирск,Юмор; Печатное издание; Юмор; Культура; Видеоигры; Фан-сообщество; Юмор; Психология; Образование; Творчество; Литература; Литература; Художник; Образование; Творчество; Художница; Художник или художница; Художница; Юмор; Художница
ж,,,Здоровый образ жизни; Товары для животных; Домашние и дикие животные; Творчество; Кино; Кино; Кино; Дизайн-студия; Кино
м,,Краснодар,"Дизайн и графика; Интернет-СМИ; Городское сообщество; Интернет-СМИ; Общество; Дизайн и графика; Интернет-СМИ; Обучающие курсы; Бизнес; Туризм, путешествия; Интернет-провайдер; Образование; Фотография; Программное обеспечение; Дизайн и графика; Школа; Дизайн и графика; Реклама; Программное обеспечение; Дизайн и графика"
м,,,"Дизайн интерьера; Сериал; Зоопарк; Образование; Юмор; Танцевальная музыка; Кино; Кино; Культура; Образование; Художник; Режиссёр, продюсер; Кино; Интернет-СМИ; Общество; Архив; Учёный, преподаватель; Философия; Юмор; Литература"
м,21.6.1988,Омск,"Фотография; Творчество; Фотограф; Наука; Фотограф; Фотография; Творчество; Стиль, одежда, обувь; Фотография; Юмор; Фотограф; Культура; Фитнес; Здоровый образ жизни; Фотография; Фан-сообщество; Фотография; Другая музыка; Одежда, обувь; Блогер"
м,20.4.1987,Павловский Посад,Городское сообщество; Городское сообщество; Городское сообщество; История; Фан-сообщество; Футбол; Молодёжное движение; Государственная организация; Тату-салон; Фан-сообщество; Автомобили; Рыбалка; Творчество; Литература; Городское сообщество; Публичная страница; Рок; Культура; Спортсмен; Автомобили
м,,Рыбинск,Дизайн и графика; Программное обеспечение; Интернет-СМИ; Туристическое агентство; Языки; Общество; Телеканал; Домашние и дикие животные; Кино; Фотография; Другие товары; Настольные игры; Наука; Дизайн и графика; Фитнес-центр; Игровая студия; Художник; Кино; Объявления; Настольные игры
ж,,Уфа,
м,,Москва,Культурный центр; Дизайн-студия; Творчество; Дизайн и графика; Дискуссионный клуб; Творчество; Культура; Дизайн и графика; Производство контента; Зоопарк; Творчество; Художник; Журналист; Видеоигры; Кино; Анимация; Творчество; Обучающие курсы; Настольные игры; Юмор
м,,Москва,"Группа коллег; Творчество; Рок; Музыкальная группа; Творчество; Юмор; Культура; Соседи; Дизайн и графика; Литература; Творчество; Литература; Электронная музыка; Культура; Культура; Народная музыка, фолк; Туризм, путешествия; Салон красоты; Народная музыка, фолк; Дизайн интерьера"
м,,,
м,11.2.1983,Обнинск,"Астрология, эзотерика; Домашние и дикие животные; Юмор; Астрология, эзотерика; Литература; Художник; Юмор; Видеоигры; Творчество; Юмор; Творчество; Блогер; Видеоигры; Мультфильм; Эротика; Юмор; ВКонтакте; Блогер; Анимация; Юмор"
ж,12.6.1981,Ставрополь,"Литература; Юмор; Юмор; Юмор; Дизайн интерьера; Творчество; Образование; Литература; Знакомства; Государственная организация; Строительство, ремонт; Государственная организация; Образование; Дизайн интерьера; Наука; Аптека, оптика; Электроника; Кулинария, рецепты; Литература; Общественный деятель"
м,26.2.1986,Москва,"Издательский дом; Музыкант; Настольные игры; Настольные игры; Настольные игры; Настольные игры; Творчество; Книжный магазин; Игры, игрушки; Настольные игры; Другие товары; Настольные игры; Настольные игры; Игры, игрушки; Игры, игрушки; Культурный центр; Издательский дом; Настольные игры; Настольные игры; Игры"
м,,,"Городское сообщество; Городское сообщество; Техника, электроника; Техника, электроника; Юмор; Приложение; Городское сообщество; Дом культуры; Государственная организация; Программирование; Техника, электроника; Юмор; Программирование; Другая музыка; Техника, электроника; Образование; Кулинария, рецепты; Техника, электроника; Городское сообщество; Программирование"
м,,,
м,,Санкт-Петербург,"Юмор; Кино; Юмор; Кулинария, рецепты; Кино; Кулинария, рецепты; Фотография; Строительство, ремонт; Строительство, ремонт; Товары для дома; Юмор; Объявления; Кулинария, рецепты; Творчество; ВКонтакте; Творчество; Наука; Творчество; Городское сообщество; Творчество"
м,,,
м,,Москва,
